{
  "schemaVersion": 2,
  "revisions": {
    "codeOss": "645f29cc3176500b4b5762ba887cf2a7f0ffdf2c",
    "webScene": "24c18362906da7314eeda6e1af12f7eafb7afad5",
    "appScene": "773e94e26b58eac423ca24d5e47bea172965c94c",
    "wpt": "2c705104a295c48053eeddf7fe0170d790a4e853"
  },
  "cssSlice": {
    "path": "tests/WebPlatformSubset/css-capability-matrix.json",
    "sha256": "5ec2dedd957b91d3220504bca19073f844f4b17405c4a674fbc631d4b15bad7a",
    "schema": "webscene-css-capability-matrix-v1",
    "matrixVersion": "1.0.0",
    "profileSha256": "6729c7c53e35f61dfbf9db278244693a6ff46571a34bbeed14e9683e61720c4a",
    "denominators": {
      "capabilities": {
        "supported": 4,
        "partial": 5,
        "total": 9
      },
      "native": {
        "pass": 32,
        "fail": 0,
        "skipped": 0,
        "unavailable": 0,
        "total": 32
      },
      "browser": {
        "pass": 25,
        "fail": 7,
        "skipped": 0,
        "unavailable": 0,
        "total": 32
      }
    }
  },
  "claims": [
    {
      "id": "abort",
      "reachable": true,
      "state": "blocked",
      "issues": [
        "WebScene#263",
        "WebScene#766"
      ],
      "evidence": [],
      "limits": [
        "Static abort, timeout, any, branded main/iframe signals, bounded composition ownership, and lifecycle gates are authored but unexecuted under the active implementation-throughput directive.",
        "Installed Code OSS request/fetch cancellation and teardown acceptance remains pending across the release platforms."
      ],
      "reason": "AbortSignal static composition, branded EventTarget behavior, asynchronous timeout delivery, bounded fan-in, dependent-listener cleanup, and realm retirement are implemented with authored native/browser gates at WebScene d5b7670e; those gates and packaged Code OSS acceptance have not yet run.",
      "platforms": [
        "linux-x64",
        "macos-arm64",
        "windows-x64"
      ]
    },
    {
      "id": "animation-frame",
      "reachable": true,
      "state": "blocked",
      "issues": [
        "WebScene#242",
        "WebScene#258"
      ],
      "evidence": [],
      "limits": [],
      "reason": "Frame scheduling has focused coverage but lacks a complete Code OSS idle, visibility, cancellation, and panel-churn evidence bundle.",
      "platforms": [
        "linux-x64",
        "macos-arm64",
        "windows-x64"
      ]
    },
    {
      "id": "broadcast-channel",
      "reachable": true,
      "state": "blocked",
      "issues": [
        "WebScene#81",
        "WebScene#764"
      ],
      "evidence": [],
      "limits": [
        "Implementation and regression gates are authored but unexecuted under the active implementation-throughput directive.",
        "Installed Code OSS Markdown diff-preview, profile, IndexedDB file-change, and voice ownership scenarios remain unaccepted."
      ],
      "reason": "Origin-partitioned structured-clone routing, FIFO delivery, bounded queues, and teardown are implemented with authored native/browser gates at WebScene 5ca0e542; those gates and packaged Code OSS acceptance have not yet run.",
      "platforms": [
        "linux-x64",
        "macos-arm64",
        "windows-x64"
      ]
    },
    {
      "id": "cache-storage",
      "reachable": true,
      "state": "blocked",
      "issues": [
        "WebScene#266"
      ],
      "evidence": [],
      "limits": [
        "Authored component and product-fixture gates have not been promoted as accepted evidence in this ledger."
      ],
      "reason": "Bounded CacheStorage and service-worker resource contracts are implemented and authored; cross-platform packaged webview acceptance remains unrecorded.",
      "platforms": [
        "linux-x64",
        "macos-arm64",
        "windows-x64"
      ]
    },
    {
      "id": "canvas-2d",
      "reachable": true,
      "state": "blocked",
      "issues": [
        "WebScene#227"
      ],
      "evidence": [],
      "limits": [],
      "reason": "Broad engine coverage exists, but the accepted Code OSS visual scenarios have not yet supplied revision-pinned product evidence here.",
      "platforms": [
        "linux-x64",
        "macos-arm64",
        "windows-x64"
      ]
    },
    {
      "id": "clipboard",
      "reachable": true,
      "state": "blocked",
      "issues": [
        "WebScene#227"
      ],
      "evidence": [],
      "limits": [],
      "reason": "The host ABI exists; editor, terminal, webview, denial, focus, and large-payload product qualification is incomplete.",
      "platforms": [
        "linux-x64",
        "macos-arm64",
        "windows-x64"
      ]
    },
    {
      "id": "crypto",
      "reachable": true,
      "state": "blocked",
      "issues": [
        "WebScene#102"
      ],
      "evidence": [],
      "limits": [],
      "reason": "The vetted-provider runtime surface is complete; configured unchanged-package MCP secret-input and browser connection-secret persistence/reopen evidence remains missing across the release RIDs. Stock Code OSS omits proprietary VSDA assets, and bundled Copilot HMAC executes in its Node extension host.",
      "platforms": [
        "linux-x64",
        "macos-arm64",
        "windows-x64"
      ]
    },
    {
      "id": "dom-core",
      "reachable": true,
      "state": "blocked",
      "issues": [
        "WebScene#227",
        "WebScene#260"
      ],
      "evidence": [],
      "limits": [],
      "reason": "DOM coverage is extensive but no exhaustive reachable-surface and accepted-scenario reconciliation has been promoted.",
      "platforms": [
        "linux-x64",
        "macos-arm64",
        "windows-x64"
      ]
    },
    {
      "id": "drag-drop",
      "reachable": true,
      "state": "blocked",
      "issues": [
        "WebScene#260"
      ],
      "evidence": [],
      "limits": [],
      "reason": "Drag/drop primitives and focused contracts exist; Explorer/editor end-to-end behavior, cancellation, native input, and cross-platform package evidence remain unaccepted.",
      "platforms": [
        "linux-x64",
        "macos-arm64",
        "windows-x64"
      ]
    },
    {
      "id": "fetch",
      "reachable": true,
      "state": "blocked",
      "issues": [
        "WebScene#266"
      ],
      "evidence": [],
      "limits": [
        "The ledger intentionally remains blocked until the current revision is exercised by the accepted product scenarios."
      ],
      "reason": "Fetch, controlled-resource admission, streaming, abort, range, and origin-policy slices are implemented with authored gates; accepted cross-platform packaged evidence remains missing.",
      "platforms": [
        "linux-x64",
        "macos-arm64",
        "windows-x64"
      ]
    },
    {
      "id": "file-api",
      "reachable": true,
      "state": "blocked",
      "issues": [
        "WebScene#269"
      ],
      "evidence": [],
      "limits": [],
      "reason": "Blob and FileReader paths exist; complete edit/save/revert/conflict/recovery qualification remains open.",
      "platforms": [
        "linux-x64",
        "macos-arm64",
        "windows-x64"
      ]
    },
    {
      "id": "file-system-access",
      "reachable": true,
      "state": "blocked",
      "issues": [
        "WebScene#248",
        "AppScene#123"
      ],
      "evidence": [],
      "limits": [],
      "reason": "Typed host grants, picker handles, directory iteration, and lifecycle work exist; installed-package open-folder/file qualification and cross-platform evidence remain incomplete.",
      "platforms": [
        "linux-x64",
        "macos-arm64",
        "windows-x64"
      ]
    },
    {
      "id": "focus-selection",
      "reachable": true,
      "state": "blocked",
      "issues": [
        "WebScene#260",
        "WebScene#262"
      ],
      "evidence": [],
      "limits": [],
      "reason": "Focus, selection, input, and accessibility slices have focused implementations; complete Code OSS keyboard/focus restoration and packaged accessibility qualification remain open.",
      "platforms": [
        "linux-x64",
        "macos-arm64",
        "windows-x64"
      ]
    },
    {
      "id": "form-data",
      "reachable": true,
      "state": "blocked",
      "issues": [
        "WebScene#266"
      ],
      "evidence": [],
      "limits": [],
      "reason": "FormData and multipart transport support exist in the runtime; bounded cross-platform webview/product evidence has not been accepted.",
      "platforms": [
        "linux-x64",
        "macos-arm64",
        "windows-x64"
      ]
    },
    {
      "id": "iframe",
      "reachable": true,
      "state": "blocked",
      "issues": [
        "WebScene#253",
        "WebScene#264",
        "WebScene#265",
        "WebScene#266",
        "WebScene#267",
        "WebScene#268"
      ],
      "evidence": [
        {
          "kind": "browser",
          "path": "tests/WebPlatformSubset/contracts/iframe-sandbox-dom-token-list.html",
          "platforms": [
            "macos-arm64"
          ],
          "revision": "16080105cbd6e88e347510c47c99e5b9dc45ab83",
          "sha256": "fc088f2f5987d226f4d46df949da84ddcb4fa1c571a3f0327effb924a577dd6d",
          "counts": {
            "pass": 6,
            "fail": 0,
            "skipped": 0,
            "unavailable": 0,
            "total": 6
          },
          "run": "https://github.com/SceneTech/WebScene/pull/273"
        },
        {
          "kind": "native",
          "path": "tests/WebPlatformSubset/contracts/iframe-sandbox-dom-token-list.html",
          "platforms": [
            "linux-x64"
          ],
          "revision": "16080105cbd6e88e347510c47c99e5b9dc45ab83",
          "sha256": "fc088f2f5987d226f4d46df949da84ddcb4fa1c571a3f0327effb924a577dd6d",
          "counts": {
            "pass": 6,
            "fail": 0,
            "skipped": 0,
            "unavailable": 0,
            "total": 6
          },